{
 "schema": "hm-direction/3",
 "meta": {
  "id": "T01-noomi-late-night-15s-076e81",
  "title": "My Brain at 2 AM",
  "fps": 30,
  "duration": 15,
  "width": 1080,
  "height": 1920,
  "subframes": 3,
  "subframeMax": 16,
  "subframePx": 2,
  "shutter": 0.4,
  "P": 0,
  "runtime": "v3",
  "score": "soundtrack-v2",
  "profile": "final",
  "internal": true,
  "layout": "page",
  "template": "T01-brain-at-2am",
  "spec": "T01-noomi-late-night-15s-076e81",
  "fingerprint": "sha256:076e81ef6738e273b6e530b0f9ed63e9d44ee488bb1086949f34c0f56befa882",
  "composer": "3.0.0"
 },
 "anchors": {
  "COVER": 0,
  "ANTIC": 0.26,
  "GAG": 0.4,
  "IMPACT": 0.98,
  "HOOK_OUT": 2.72,
  "L1": 3,
  "L2": 4,
  "L3": 5,
  "PEAK0": 5.6,
  "PEAK1": 7,
  "TURN": 7,
  "RITUAL0": 7.4,
  "RITUAL1": 11.5,
  "OPEN": 11.7,
  "RESOLVE": 11.9,
  "LOGO": 12.6,
  "SETTLE": 13.5,
  "CARD_OUT": 14.3,
  "HOOK_IN": 14.66,
  "END": 15,
  "breathPeriod": 3.75,
  "squeeze": 6.98,
  "relax": 7.32,
  "inhale": 7.42,
  "crest": 8.9,
  "exhale": 9.2,
  "dissolve0": 9.42,
  "dissolve1": 9.62,
  "dissolve2": 9.82,
  "open": 11.7,
  "tagline": 11.9,
  "logo": 12.6,
  "slowBlink": 12.8,
  "sleep": 13.5,
  "cardOut": 14.3
 },
 "mallow": {
  "id": "noomi",
  "registry": "noomi",
  "rigScale": 2.7,
  "assets": {
   "pristine": "assets/noomi/noomi-art.png",
   "clean": "assets/noomi/noomi-clean.png",
   "normal": "assets/noomi/noomi-normal.png",
   "face": "assets/noomi/noomi-face.json"
  },
  "artSize": [
   1199,
   1110
  ],
  "placement": {
   "baseX": 540,
   "baseY": 1300,
   "scale": 0.56
  },
  "silhouette": {
   "x0": 31,
   "x1": 1164,
   "top": 28,
   "baseY": 1078,
   "cx": 597.5,
   "halfW": 566.5,
   "w": 1133,
   "h": 1050
  },
  "faceSpec": {
   "line": "#0a1450",
   "eyes": {
    "L": {
     "x": 386.20000000000005,
     "y": 607.7,
     "hw": 105.1,
     "sag": 41.69999999999993,
     "lw": 40.8,
     "tilt": -1.599999999999966,
     "cxOff": -5.600000000000023,
     "r": 99.1,
     "irisR": 64.80000000000001,
     "irisOff": [
      8.100000000000001,
      0
     ]
    },
    "R": {
     "x": 819.25,
     "y": 607.25,
     "hw": 109.45000000000005,
     "sag": 45.075000000000045,
     "lw": 40,
     "tilt": 1.0499999999999545,
     "cxOff": 7.0499999999999545,
     "r": 102.2,
     "irisR": 64.80000000000001,
     "irisOff": [
      -8.100000000000001,
      0
     ]
    }
   },
   "brows": {
    "L": {
     "p0": [
      297.1,
      499.70000000000005
     ],
     "c": [
      383.5,
      472.70000000000005
     ],
     "p1": [
      469.90000000000003,
      494.3
     ],
     "lw": 29.700000000000003
    },
    "R": {
     "p0": [
      734.1999999999999,
      493.31
     ],
     "c": [
      820.6,
      471.71000000000004
     ],
     "p1": [
      907,
      498.71000000000004
     ],
     "lw": 29.700000000000003
    }
   },
   "mouth": {
    "x": 595.15,
    "y": 759.9,
    "w": 209.7,
    "sag": 41.39999999999998,
    "lw": 36.4,
    "cxOff": -1.0499999999999545,
    "tilt": 0.8999999999999773
   },
   "cheeks": {
    "L": [
     264.1,
     725.7,
     85.9
    ],
    "R": [
     919.2,
     737.3,
     85.7
    ],
    "colour": "#ff7ff0"
   },
   "colors": {
    "core": {
     "rgb": [
      1,
      24,
      92
     ],
     "hex": "#01185c"
    },
    "coreUpper": {
     "rgb": [
      6,
      51,
      161
     ],
     "hex": "#0633a1"
    },
    "coreLower": {
     "rgb": [
      1,
      18,
      86
     ],
     "hex": "#011256"
    },
    "highlight": {
     "color": {
      "rgb": [
       69,
       126,
       234
      ],
      "hex": "#457eea"
     },
     "offset": 11.6,
     "width": 2.8
    },
    "glow": {
     "color": {
      "rgb": [
       0,
       144,
       253
      ],
      "hex": "#0090fd"
     },
     "sampledAtEdge": {
      "rgb": [
       33,
       147,
       252
      ],
      "hex": "#2193fc"
     },
     "alphaAtEdge": 0.817,
     "blurSigma": 19.3,
     "blurRadius": 48.2,
     "reach": 48
    },
    "underGlow": {
     "peakOffset": 30,
     "peakGain": 1.011,
     "extent": 38,
     "colorAtPeak": {
      "rgb": [
       201,
       219,
       251
      ],
      "hex": "#c9dbfb"
     }
    }
   }
  },
  "faceStyle": "closed-tube",
  "body": {
   "lag": 0.062,
   "cols": 96,
   "rows": 96
  },
  "limits": {
   "heightMin": 0.6,
   "stretchMax": 1.4,
   "shrinkMin": 0.6
  },
  "light": {
   "dir": [
    0.45,
    0.55,
    0.7
   ],
   "sss": 1
  }
 },
 "realm": {
  "id": "moonmilk-cove",
  "tod": "late-night",
  "palette": {
   "base": {
    "zenith": "#05071c",
    "high": "#12164a",
    "horizon": "#4a3f8e",
    "haze": "#8b7fcf",
    "moonCol": "#fbf7ff",
    "haloCol": "#a59cff",
    "cloudLit": "#c9c2ff",
    "cloudDark": "#1d1a4a",
    "hillCol": "#141238",
    "waterNear": "#070823",
    "waterFar": "#2a2768",
    "key": "#f7f9ff",
    "rim": "#a9a2ff",
    "ambient": "#3a3480",
    "specCol": "#d9e6ff",
    "glowCol": "#ffcf9a",
    "n": {
     "moonGlow": 1,
     "stars": 1,
     "clouds": 0.5,
     "exposure": 1,
     "sat": 1.03,
     "rimAmt": 0.32,
     "spec": 0.5,
     "glow": 0
    },
    "shadowTint": [
     0.95,
     0.97,
     1.05
    ],
    "highTint": [
     1,
     1,
     1
    ]
   },
   "tense": {
    "zenith": "#03040d",
    "high": "#0a0d27",
    "horizon": "#262b56",
    "haze": "#4f5689",
    "moonCol": "#dfe6ff",
    "haloCol": "#7882c2",
    "cloudLit": "#7f87bd",
    "cloudDark": "#0e1029",
    "hillCol": "#090a1e",
    "waterNear": "#04050e",
    "waterFar": "#181c40",
    "key": "#c3cdee",
    "rim": "#8592dc",
    "ambient": "#1b2149",
    "specCol": "#c9d6ff",
    "glowCol": "#ffcf9a",
    "n": {
     "moonGlow": 0.5,
     "stars": 0.3,
     "clouds": 0.98,
     "exposure": 0.93,
     "sat": 0.88,
     "rimAmt": 0.26,
     "spec": 0.42,
     "glow": 0
    },
    "shadowTint": [
     0.92,
     0.97,
     1.08
    ],
    "highTint": [
     0.97,
     0.99,
     1.03
    ]
   },
   "resolved": {
    "zenith": "#0a0820",
    "high": "#281c56",
    "horizon": "#875c9b",
    "haze": "#d9a2c2",
    "moonCol": "#fff4dc",
    "haloCol": "#ffc5a3",
    "cloudLit": "#ffd6c2",
    "cloudDark": "#35275a",
    "hillCol": "#21153c",
    "waterNear": "#0c0a23",
    "waterFar": "#45316b",
    "key": "#fffaf4",
    "rim": "#ffc09a",
    "ambient": "#4a3a70",
    "specCol": "#fff0dc",
    "glowCol": "#ffd2a0",
    "n": {
     "moonGlow": 1.35,
     "stars": 1.25,
     "clouds": 0.16,
     "exposure": 1,
     "sat": 1.04,
     "rimAmt": 0.5,
     "spec": 0.55,
     "glow": 0.07
    },
    "shadowTint": [
     0.98,
     0.96,
     1.05
    ],
    "highTint": [
     1.04,
     1,
     0.95
    ]
   }
  },
  "world": {
   "horizonY": 1150,
   "moon": [
    850,
    590,
    50
   ],
   "fresnel": 1,
   "reflAmt": 0.62,
   "shadow": 0.55,
   "shadowFall": 45,
   "contactSpread": 0.5,
   "skyParallax": 0.35,
   "skyCentreX": 540,
   "rippleLife": 6
  },
  "post": {
   "bloom": 0.14,
   "bloomThresh": 0.85,
   "contrast": 1.04,
   "vignette": 0.38,
   "vignetteTension": 0.08,
   "grain": 0.018
  },
  "jitter": null
 },
 "channels": {
  "body.inflate": {
   "type": "track",
   "v0": 0,
   "f": 2.4,
   "z": 0.85,
   "keys": [
    {
     "t": 0.4,
     "v": 0.06,
     "f": 6,
     "z": 0.6,
     "by": "G-JOLT"
    },
    {
     "t": 0.75,
     "v": 0,
     "f": 2,
     "z": 0.8,
     "by": "G-JOLT"
    },
    {
     "t": 7.42,
     "v": 0.21,
     "f": 2.4,
     "z": 0.85,
     "ease": "inOutSine",
     "dur": 1.4800000000000004,
     "by": "R-BREATH"
    },
    {
     "t": 9.2,
     "v": -0.035,
     "f": 2.4,
     "z": 0.85,
     "ease": "inOutSine",
     "dur": 1.9,
     "by": "R-BREATH"
    },
    {
     "t": 11.4,
     "v": 0,
     "f": 0.7,
     "z": 1,
     "by": "R-BREATH"
    }
   ],
   "windows": [
    {
     "by": "G-JOLT",
     "from": 0.26,
     "to": 3
    },
    {
     "by": "R-BREATH",
     "from": 7.4,
     "to": 11.45
    }
   ]
  },
  "body.inflate.breath": {
   "type": "sine",
   "amp": 0.03,
   "period": 3.75,
   "env": "breath",
   "by": "acting/idle-breath"
  },
  "body.inflate.pant": {
   "type": "sine",
   "amp": 0.012,
   "freq": 1.7,
   "env": "pant",
   "by": "acting/aftermath-startled"
  },
  "body.lean": {
   "type": "track",
   "v0": 0,
   "f": 2.2,
   "z": 0.75,
   "keys": [
    {
     "t": 1.85,
     "v": -0.025,
     "f": 2.2,
     "z": 0.75,
     "by": "acting/aftermath-startled"
    },
    {
     "t": 2.2,
     "v": 0.025,
     "f": 2.2,
     "z": 0.75,
     "by": "acting/aftermath-startled"
    },
    {
     "t": 2.58,
     "v": 0,
     "f": 2.2,
     "z": 0.75,
     "by": "acting/aftermath-startled"
    },
    {
     "t": 3.1,
     "v": -0.025592955109905162,
     "f": 2.2,
     "z": 0.75,
     "by": "M-ORBIT"
    },
    {
     "t": 4.1,
     "v": 0.02631406317333727,
     "f": 2.2,
     "z": 0.75,
     "by": "M-ORBIT"
    },
    {
     "t": 5.1,
     "v": 0.005352594568783106,
     "f": 2.2,
     "z": 0.75,
     "by": "M-ORBIT"
    },
    {
     "t": 5.6,
     "v": 0,
     "f": 2.2,
     "z": 0.75,
     "by": "M-ORBIT"
    },
    {
     "t": 6.98,
     "v": 0,
     "f": 2.2,
     "z": 0.75,
     "by": "TURN-SQUEEZE"
    }
   ],
   "windows": [
    {
     "by": "acting/aftermath-startled",
     "from": 0.98,
     "to": 3
    },
    {
     "by": "M-ORBIT",
     "from": 3,
     "to": 6.95
    },
    {
     "by": "TURN-SQUEEZE",
     "from": 6.95,
     "to": 7.4
    }
   ]
  },
  "body.lift": {
   "type": "track",
   "v0": 0,
   "f": 2.4,
   "z": 0.85,
   "keys": [
    {
     "t": 7.42,
     "v": 36,
     "f": 2.4,
     "z": 0.85,
     "ease": "inOutSine",
     "dur": 1.4800000000000004,
     "by": "R-BREATH"
    },
    {
     "t": 9.2,
     "v": 0,
     "f": 1.1,
     "z": 0.62,
     "by": "R-BREATH"
    }
   ],
   "windows": [
    {
     "by": "R-BREATH",
     "from": 7.4,
     "to": 11.45
    }
   ]
  },
  "body.lift.hops": {
   "type": "hops",
   "list": [
    {
     "t0": 0.4,
     "t1": 0.98,
     "h": 165,
     "by": "G-JOLT"
    }
   ]